{
  "contract_version": "1.0",
  "decision_outcome": "NO_ACTION",
  "reason_code": "nothing_useful",
  "evidence_refs": [],
  "provenance": {
    "policy": "ayla-decision-policy",
    "step": "none"
  },
  "blocked_capabilities": [],
  "calculated_at": "2026-09-21T09:00:00+03:00",
  "policy_version": "example-policy-v1"
}
